{
  "description": "bulkWrite-updateMany-hint-unacknowledged",
  "schemaVersion": "1.0",
  "createEntities": [
    {
      "client": {
        "id": "client0",
        "observeEvents": [
          "commandStartedEvent"
        ]
      }
    },
    {
      "database": {
        "id": "database0",
        "client": "client0",
        "databaseName": "db0"
      }
    },
    {
      "collection": {
        "id": "collection0",
        "database": "database0",
        "collectionName": "coll0",
        "collectionOptions": {
          "writeConcern": {
            "w": 0
          }
        }
      }
    }
  ],
  "initialData": [
    {
      "collectionName": "coll0",
      "databaseName": "db0",
      "documents": [
        {
          "_id": 1,
          "x": 11
        },
        {
          "_id": 2,
          "x": 22
        },
        {
          "_id": 3,
          "x": 33
        }
      ]
    }
  ],
  "tests": [
    {
      "description": "Unacknowledged updateMany with hint string on 4.2+ server",
      "runOnRequirements": [
        {
          "minServerVersion": "4.2.0"
        }
      ],
      "operations": [
        {
          "object": "collection0",
          "name": "bulkWrite",
          "arguments": {
            "requests": [
              {
                "updateMany": {
                  "filter": {
                    "_id": {
                      "$gt": 1
                    }
                  },
                  "update": {
                    "$inc": {
                      "x": 1
                    }
                  },
                  "hint": "_id_"
                }
              }
            ]
          },
          "expectResult": {
            "$$unsetOrMatches": {
              "acknowledged": {
                "$$unsetOrMatches": false
              }
            }
          }
        }
      ],
      "expectEvents": [
        {
          "client": "client0",
          "events": [
            {
              "commandStartedEvent": {
                "command": {
                  "update": "coll0",
                  "updates": [
                    {
                      "q": {
                        "_id": {
                          "$gt": 1
                        }
                      },
                      "u": {
                        "$inc": {
                          "x": 1
                        }
                      },
                      "multi": true,
                      "upsert": {
                        "$$unsetOrMatches": false
                      },
                      "hint": {
                        "$$type": [
                          "string",
                          "object"
                        ]
                      }
                    }
                  ],
                  "writeConcern": {
                    "w": 0
                  }
                }
              }
            }
          ]
        }
      ]
    },
    {
      "description": "Unacknowledged updateMany with hint document on 4.2+ server",
      "runOnRequirements": [
        {
          "minServerVersion": "4.2.0"
        }
      ],
      "operations": [
        {
          "object": "collection0",
          "name": "bulkWrite",
          "arguments": {
            "requests": [
              {
                "updateMany": {
                  "filter": {
                    "_id": {
                      "$gt": 1
                    }
                  },
                  "update": {
                    "$inc": {
                      "x": 1
                    }
                  },
                  "hint": {
                    "_id": 1
                  }
                }
              }
            ]
          },
          "expectResult": {
            "$$unsetOrMatches": {
              "acknowledged": {
                "$$unsetOrMatches": false
              }
            }
          }
        }
      ],
      "expectEvents": [
        {
          "client": "client0",
          "events": [
            {
              "commandStartedEvent": {
                "command": {
                  "update": "coll0",
                  "updates": [
                    {
                      "q": {
                        "_id": {
                          "$gt": 1
                        }
                      },
                      "u": {
                        "$inc": {
                          "x": 1
                        }
                      },
                      "multi": true,
                      "upsert": {
                        "$$unsetOrMatches": false
                      },
                      "hint": {
                        "$$type": [
                          "string",
                          "object"
                        ]
                      }
                    }
                  ],
                  "writeConcern": {
                    "w": 0
                  }
                }
              }
            }
          ]
        }
      ]
    }
  ]
}
