{
  "description": "insertMany-comment",
  "schemaVersion": "1.0",
  "runOnRequirements": [
    {
      "minServerVersion": "4.4"
    }
  ],
  "createEntities": [
    {
      "client": {
        "id": "client0",
        "observeEvents": [
          "commandStartedEvent"
        ]
      }
    },
    {
      "database": {
        "id": "database0",
        "client": "client0",
        "databaseName": "crud-tests"
      }
    },
    {
      "collection": {
        "id": "collection0",
        "database": "database0",
        "collectionName": "coll0"
      }
    }
  ],
  "initialData": [
    {
      "collectionName": "coll0",
      "databaseName": "crud-tests",
      "documents": [
        {
          "_id": 1,
          "x": 11
        }
      ]
    }
  ],
  "tests": [
    {
      "description": "insertMany with string comment",
      "operations": [
        {
          "name": "insertMany",
          "object": "collection0",
          "arguments": {
            "documents": [
              {
                "_id": 2,
                "x": 22
              }
            ],
            "comment": "comment"
          }
        }
      ],
      "expectEvents": [
        {
          "client": "client0",
          "events": [
            {
              "commandStartedEvent": {
                "command": {
                  "insert": "coll0",
                  "documents": [
                    {
                      "_id": 2,
                      "x": 22
                    }
                  ],
                  "comment": "comment"
                }
              }
            }
          ]
        }
      ]
    },
    {
      "description": "insertMany with document comment",
      "operations": [
        {
          "name": "insertMany",
          "object": "collection0",
          "arguments": {
            "documents": [
              {
                "_id": 2,
                "x": 22
              }
            ],
            "comment": {
              "key": "value"
            }
          }
        }
      ],
      "expectEvents": [
        {
          "client": "client0",
          "events": [
            {
              "commandStartedEvent": {
                "command": {
                  "insert": "coll0",
                  "documents": [
                    {
                      "_id": 2,
                      "x": 22
                    }
                  ],
                  "comment": {
                    "key": "value"
                  }
                }
              }
            }
          ]
        }
      ]
    }
  ]
}
