{
  "description": "find-comment",
  "schemaVersion": "1.0",
  "createEntities": [
    {
      "client": {
        "id": "client0",
        "observeEvents": [
          "commandStartedEvent"
        ]
      }
    },
    {
      "database": {
        "id": "database0",
        "client": "client0",
        "databaseName": "crud-tests"
      }
    },
    {
      "collection": {
        "id": "collection0",
        "database": "database0",
        "collectionName": "coll0"
      }
    }
  ],
  "initialData": [
    {
      "collectionName": "coll0",
      "databaseName": "crud-tests",
      "documents": [
        {
          "_id": 1
        },
        {
          "_id": 2
        }
      ]
    }
  ],
  "tests": [
    {
      "description": "find with string comment",
      "operations": [
        {
          "name": "find",
          "object": "collection0",
          "arguments": {
            "filter": {
              "_id": 1
            },
            "comment": "comment"
          },
          "expectResult": [
            {
              "_id": 1
            }
          ]
        }
      ],
      "expectEvents": [
        {
          "client": "client0",
          "events": [
            {
              "commandStartedEvent": {
                "command": {
                  "find": "coll0",
                  "filter": {
                    "_id": 1
                  },
                  "comment": "comment"
                }
              }
            }
          ]
        }
      ]
    },
    {
      "description": "find with document comment",
      "runOnRequirements": [
        {
          "minServerVersion": "4.4"
        }
      ],
      "operations": [
        {
          "name": "find",
          "object": "collection0",
          "arguments": {
            "filter": {
              "_id": 1
            },
            "comment": {
              "key": "value"
            }
          },
          "expectResult": [
            {
              "_id": 1
            }
          ]
        }
      ],
      "expectEvents": [
        {
          "client": "client0",
          "events": [
            {
              "commandStartedEvent": {
                "command": {
                  "find": "coll0",
                  "filter": {
                    "_id": 1
                  },
                  "comment": {
                    "key": "value"
                  }
                }
              }
            }
          ]
        }
      ]
    },
    {
      "description": "find with document comment - pre 4.4",
      "runOnRequirements": [
        {
          "maxServerVersion": "4.2.99"
        }
      ],
      "operations": [
        {
          "name": "find",
          "object": "collection0",
          "arguments": {
            "filter": {
              "_id": 1
            },
            "comment": {
              "key": "value"
            }
          },
          "expectError": {
            "errorContains": "'comment' field must be of BSON type string",
            "isClientError": false
          }
        }
      ]
    }
  ]
}
