{
  "description": "estimatedDocumentCount-comment",
  "schemaVersion": "1.0",
  "createEntities": [
    {
      "client": {
        "id": "client0",
        "observeEvents": [
          "commandStartedEvent"
        ]
      }
    },
    {
      "database": {
        "id": "database0",
        "client": "client0",
        "databaseName": "edc-tests"
      }
    },
    {
      "collection": {
        "id": "collection0",
        "database": "database0",
        "collectionName": "coll0"
      }
    }
  ],
  "initialData": [
    {
      "collectionName": "coll0",
      "databaseName": "edc-tests",
      "documents": [
        {
          "_id": 1,
          "x": 11
        },
        {
          "_id": 2,
          "x": 22
        },
        {
          "_id": 3,
          "x": 33
        }
      ]
    }
  ],
  "tests": [
    {
      "description": "estimatedDocumentCount with document comment on 4.9.0 or greater",
      "runOnRequirements": [
        {
          "minServerVersion": "4.9.0"
        }
      ],
      "operations": [
        {
          "name": "estimatedDocumentCount",
          "object": "collection0",
          "arguments": {
            "comment": {
              "key": "value"
            }
          },
          "expectResult": 3
        }
      ],
      "expectEvents": [
        {
          "client": "client0",
          "events": [
            {
              "commandStartedEvent": {
                "command": {
                  "aggregate": "coll0",
                  "pipeline": [
                    {
                      "$collStats": {
                        "count": {}
                      }
                    },
                    {
                      "$group": {
                        "_id": 1,
                        "n": {
                          "$sum": "$count"
                        }
                      }
                    }
                  ],
                  "comment": {
                    "key": "value"
                  }
                },
                "commandName": "aggregate",
                "databaseName": "edc-tests"
              }
            }
          ]
        }
      ]
    },
    {
      "description": "estimatedDocumentCount with document comment on less than 4.9.0",
      "runOnRequirements": [
        {
          "minServerVersion": "4.4.14",
          "maxServerVersion": "4.8.99"
        }
      ],
      "operations": [
        {
          "name": "estimatedDocumentCount",
          "object": "collection0",
          "arguments": {
            "comment": {
              "key": "value"
            }
          },
          "expectResult": 3
        }
      ],
      "expectEvents": [
        {
          "client": "client0",
          "events": [
            {
              "commandStartedEvent": {
                "command": {
                  "count": "coll0",
                  "comment": {
                    "key": "value"
                  }
                },
                "commandName": "count",
                "databaseName": "edc-tests"
              }
            }
          ]
        }
      ]
    },
    {
      "description": "estimatedDocumentCount with string comment on less than 4.4.14",
      "runOnRequirements": [
        {
          "minServerVersion": "4.4.0",
          "maxServerVersion": "4.4.13"
        }
      ],
      "operations": [
        {
          "name": "estimatedDocumentCount",
          "object": "collection0",
          "arguments": {
            "comment": "comment"
          },
          "expectResult": 3
        }
      ],
      "expectEvents": [
        {
          "client": "client0",
          "events": [
            {
              "commandStartedEvent": {
                "command": {
                  "count": "coll0",
                  "comment": "comment"
                },
                "commandName": "count",
                "databaseName": "edc-tests"
              }
            }
          ]
        }
      ]
    }
  ]
}
