{
  "description": "updateOne-comment",
  "schemaVersion": "1.0",
  "runOnRequirements": [
    {
      "minServerVersion": "4.4"
    }
  ],
  "createEntities": [
    {
      "client": {
        "id": "client0",
        "observeEvents": [
          "commandStartedEvent"
        ]
      }
    },
    {
      "database": {
        "id": "database0",
        "client": "client0",
        "databaseName": "crud-tests"
      }
    },
    {
      "collection": {
        "id": "collection0",
        "database": "database0",
        "collectionName": "coll0"
      }
    }
  ],
  "initialData": [
    {
      "collectionName": "coll0",
      "databaseName": "crud-tests",
      "documents": [
        {
          "_id": 1,
          "x": 11
        }
      ]
    }
  ],
  "tests": [
    {
      "description": "UpdateOne with string comment",
      "operations": [
        {
          "name": "updateOne",
          "object": "collection0",
          "arguments": {
            "filter": {
              "_id": 1
            },
            "update": {
              "x": 22
            },
            "comment": "comment"
          }
        }
      ],
      "expectEvents": [
        {
          "client": "client0",
          "events": [
            {
              "commandStartedEvent": {
                "command": {
                  "update": "coll0",
                  "updates": [
                    {
                      "q": {
                        "_id": 1
                      },
                      "u": {
                        "x": 22
                      }
                    }
                  ],
                  "comment": "comment"
                }
              }
            }
          ]
        }
      ]
    },
    {
      "description": "UpdateOne with document comment",
      "operations": [
        {
          "name": "updateOne",
          "object": "collection0",
          "arguments": {
            "filter": {
              "_id": 1
            },
            "update": {
              "x": 22
            },
            "comment": {
              "key": "value"
            }
          }
        }
      ],
      "expectEvents": [
        {
          "client": "client0",
          "events": [
            {
              "commandStartedEvent": {
                "command": {
                  "update": "coll0",
                  "updates": [
                    {
                      "q": {
                        "_id": 1
                      },
                      "u": {
                        "x": 22
                      }
                    }
                  ],
                  "comment": {
                    "key": "value"
                  }
                }
              }
            }
          ]
        }
      ]
    }
  ]
}
